{
  "$schema": "https://json-schema.org/draft/2020-12/schema",
  "$id": "https://example.com/repeatedTransactionOccurrence.schema.json",
  "title": "Repeated Transaction Occurrence",
  "description": "Manages occurrences of repeated transactions, including tracking their modifications or logical deletions. 'transactionId' is required when an occurrence is modified to link it to an actual transaction.",
  "type": "object",
  "properties": {
    "id": {
      "type": "string",
      "description": "Unique identifier for the occurrence record."
    },
    "transactionId": {
      "type": ["string", "null"],
      "description": "Identifier of the actual transaction, required if the occurrence is modified."
    },
    "repeatedTransactionId": {
      "type": "string",
      "description": "Identifier of the associated repeated transaction."
    },
    "expectedDate": {
      "type": "string",
      "format": "date",
      "description": "The date when the occurrence is expected."
    },
    "occurrenceStatus": {
      "type": "string",
      "enum": ["modified", "deleted"],
      "description": "Status of the occurrence, indicating if it has been modified or logically deleted."
    },
    "createdAt": {
      "type": "string",
      "format": "date-time",
      "description": "Timestamp of when the occurrence was created."
    },
    "updatedAt": {
      "type": ["string", "null"],
      "format": "date-time",
      "description": "Timestamp of the last update to the occurrence. Nullable to accommodate occurrences that have not been updated."
    }
  },
  "required": [
    "id",
    "repeatedTransactionId",
    "expectedDate",
    "occurrenceStatus",
    "createdAt"
  ],
  "additionalProperties": false,
  "if": {
    "properties": { "occurrenceStatus": { "const": "modified" } }
  },
  "then": {
    "required": ["transactionId"]
  }
}
