[
  {
    "id": "occ-link-uuid-0001",
    "transactionId": "trans-uuid-0001",
    "repeatedTransactionId": "rep-trans-uuid-0001",
    "expectedDate": "2024-07-15",
    "occurrenceStatus": "modified",
    "createdAt": "2024-01-01T10:00:00Z",
    "updatedAt": "2024-01-02T10:00:00Z"
  },
  {
    "id": "occ-link-uuid-0002",
    "repeatedTransactionId": "rep-trans-uuid-0002",
    "expectedDate": "2024-08-01",
    "occurrenceStatus": "deleted",
    "createdAt": "2024-01-15T10:00:00Z",
    "updatedAt": "2024-01-20T10:00:00Z"
  },
  {
    "id": "occ-link-uuid-0003",
    "transactionId": "trans-uuid-0002",
    "repeatedTransactionId": "rep-trans-uuid-0003",
    "expectedDate": "2024-08-15",
    "occurrenceStatus": "modified",
    "createdAt": "2024-02-01T10:00:00Z",
    "updatedAt": "2024-02-05T10:00:00Z"
  },
  {
    "id": "occ-link-uuid-0004",
    "repeatedTransactionId": "rep-trans-uuid-0004",
    "expectedDate": "2024-09-01",
    "occurrenceStatus": "deleted",
    "createdAt": "2024-03-01T10:00:00Z",
    "updatedAt": "2024-03-05T10:00:00Z"
  }
]
